datetime_iso,datetime_ph,latitude_(n),longitude_(e),depth_km,mag,location,distance_km,bearing,reference_location
2025-10-21T23:21:00.000Z,21 October 2025 - 11:21 PM,09.21,125.88,034,1.4,011km S 58° W of Madrid (Surigao Del Sur),011,S 58° W,Madrid (Surigao Del Sur)
2025-10-21T23:15:00.000Z,21 October 2025 - 11:15 PM,09.73,126.11,030,2.2,007km S 43° W of General Luna (Surigao Del Norte),007,S 43° W,General Luna (Surigao Del Norte)
2025-10-21T22:30:00.000Z,21 October 2025 - 10:30 PM,10.96,124.02,009,2.4,011km S 25° E of City Of Bogo (Cebu),011,S 25° E,City Of Bogo (Cebu)
2025-10-21T22:27:00.000Z,21 October 2025 - 10:27 PM,07.36,124.41,025,2.1,009km N 10° W of Pigkawayan (Cotabato),009,N 10° W,Pigkawayan (Cotabato)
2025-10-21T22:25:00.000Z,21 October 2025 - 10:25 PM,18.62,121.08,002,2.0,002km N 07° W of Claveria (Cagayan),002,N 07° W,Claveria (Cagayan)
2025-10-21T22:23:00.000Z,21 October 2025 - 10:23 PM,05.31,125.55,020,2.8,018km S 49° E of Balut Island (Municipality Of Sarangani) (Davao Occidental),018,S 49° E,Balut Island (Municipality Of Sarangani) (Davao Occidental)
